{"best": null, "commit": "e61d2e5", "confirm_metric": 0.896181, "delta": null, "description": "baseline (unmodified code)", "diff": ".arh/runs/0000.diff", "duration_s": 3.12, "extra": {"steps": 40904.0}, "files": [], "id": 0, "log": ".arh/runs/0000.log", "metric": 0.960452, "parent": "e61d2e5", "reason": "baseline; holdout holdout_loss=0.896181 confirmed", "status": "keep", "timestamp": "2026-09-19T15:05:36"}
{"best": 0.960452, "commit": "5566387", "confirm_metric": 0.800115, "delta": -0.08836999999999995, "description": "Add quadratic features (x^2, y^2, x*y) to allow simple non-linear boundaries; expect val_loss to drop since spirals need non-linear features.", "diff": ".arh/runs/0001.diff", "duration_s": 3.13, "extra": {"steps": 41297.0}, "files": ["train.py"], "id": 1, "log": ".arh/runs/0001.log", "metric": 0.872082, "parent": "e61d2e5", "reason": "improved on 0.960452; holdout holdout_loss=0.800115 confirmed", "status": "keep", "timestamp": "2026-09-19T15:05:54"}
{"best": 0.872082, "commit": null, "confirm_metric": null, "delta": 4.000000000004e-06, "description": "Switch optimizer to Adam (with LR 0.01) for faster, more stable convergence vs plain SGD; expect val_loss to drop by better optimization", "diff": ".arh/runs/0002.diff", "duration_s": 3.13, "extra": {"steps": 40141.0}, "files": ["train.py"], "id": 2, "log": ".arh/runs/0002.log", "metric": 0.872086, "parent": "5566387", "reason": "not better than best 0.872082", "status": "discard", "timestamp": "2026-09-19T15:06:34"}
{"best": 0.872082, "commit": "8a39750", "confirm_metric": 0.084197, "delta": -0.745167, "description": "Add polar features (r, sin(theta), cos(theta)) to better capture spiral structure; expect val_loss to drop as model can use angular info.", "diff": ".arh/runs/0003.diff", "duration_s": 3.1, "extra": {"steps": 40875.0}, "files": ["train.py"], "id": 3, "log": ".arh/runs/0003.log", "metric": 0.126915, "parent": "5566387", "reason": "improved on 0.872082; holdout holdout_loss=0.084197 confirmed", "status": "keep", "timestamp": "2026-09-19T15:07:18"}
{"best": 0.126915, "commit": "9cbd7e4", "confirm_metric": 0.007628, "delta": -0.118441, "description": "Add one hidden tanh layer (16 units) with full-batch SGD to give non-linear capacity; expect val_loss to drop as MLP can better separate spirals.", "diff": ".arh/runs/0004.diff", "duration_s": 3.12, "extra": {"steps": 16495.0}, "files": ["train.py"], "id": 4, "log": ".arh/runs/0004.log", "metric": 0.008474, "parent": "8a39750", "reason": "improved on 0.126915; holdout holdout_loss=0.007628 confirmed", "status": "keep", "timestamp": "2026-09-19T15:07:43"}
{"best": 0.008474, "commit": null, "confirm_metric": null, "delta": 0.0011149999999999997, "description": "Add biases to both layers (b1, b2) and update them with SGD; expect small improvement because biases let the network shift activations and better fit the spiral patterns.", "diff": ".arh/runs/0005.diff", "duration_s": 3.1, "extra": {"steps": 11662.0}, "files": ["train.py"], "id": 5, "log": ".arh/runs/0005.log", "metric": 0.009589, "parent": "9cbd7e4", "reason": "not better than best 0.008474", "status": "discard", "timestamp": "2026-09-19T15:08:27"}
{"best": 0.008474, "commit": "511a357", "confirm_metric": 0.010511, "delta": -0.002641000000000001, "description": "Use SGD with momentum (0.9) instead of plain SGD; expect faster, more stable convergence and lower val_loss within the same time budget.", "diff": ".arh/runs/0006.diff", "duration_s": 3.11, "extra": {"steps": 15503.0}, "files": ["train.py"], "id": 6, "log": ".arh/runs/0006.log", "metric": 0.005833, "parent": "9cbd7e4", "reason": "improved on 0.008474; holdout holdout_loss=0.010511 confirmed", "status": "keep", "timestamp": "2026-09-19T15:08:52"}
